{
  "magazine": "trains",
  "issue": "1979-06",
  "schema_version": 1,
  "pages": [
    {
      "pdf_page": 1,
      "type": "unknown",
      "source": "unknown"
    },
    {
      "pdf_page": 2,
      "type": "unknown",
      "source": "unknown"
    },
    {
      "pdf_page": 3,
      "type": "unknown",
      "source": "unknown"
    },
    {
      "pdf_page": 4,
      "type": "unknown",
      "source": "unknown"
    },
    {
      "pdf_page": 5,
      "type": "unknown",
      "source": "unknown"
    },
    {
      "pdf_page": 6,
      "type": "unknown",
      "source": "unknown"
    },
    {
      "pdf_page": 7,
      "type": "unknown",
      "source": "unknown"
    },
    {
      "pdf_page": 8,
      "type": "unknown",
      "source": "unknown"
    },
    {
      "pdf_page": 9,
      "type": "unknown",
      "source": "unknown"
    },
    {
      "pdf_page": 10,
      "type": "unknown",
      "source": "unknown"
    },
    {
      "pdf_page": 11,
      "type": "unknown",
      "source": "unknown"
    },
    {
      "pdf_page": 12,
      "type": "unknown",
      "source": "unknown"
    },
    {
      "pdf_page": 13,
      "type": "unknown",
      "source": "unknown"
    },
    {
      "pdf_page": 14,
      "type": "unknown",
      "source": "unknown"
    },
    {
      "pdf_page": 15,
      "type": "unknown",
      "source": "unknown"
    },
    {
      "pdf_page": 16,
      "type": "unknown",
      "source": "unknown"
    },
    {
      "pdf_page": 17,
      "type": "unknown",
      "source": "unknown"
    },
    {
      "pdf_page": 18,
      "type": "unknown",
      "source": "unknown"
    },
    {
      "pdf_page": 19,
      "type": "unknown",
      "source": "unknown"
    },
    {
      "pdf_page": 20,
      "type": "unknown",
      "source": "unknown"
    },
    {
      "pdf_page": 21,
      "type": "unknown",
      "source": "unknown"
    },
    {
      "pdf_page": 22,
      "type": "unknown",
      "source": "unknown"
    },
    {
      "pdf_page": 23,
      "type": "unknown",
      "source": "unknown"
    },
    {
      "pdf_page": 24,
      "type": "unknown",
      "source": "unknown"
    },
    {
      "pdf_page": 25,
      "type": "unknown",
      "source": "unknown"
    },
    {
      "pdf_page": 26,
      "type": "unknown",
      "source": "unknown"
    },
    {
      "pdf_page": 27,
      "type": "unknown",
      "source": "unknown"
    },
    {
      "pdf_page": 28,
      "type": "unknown",
      "source": "unknown"
    },
    {
      "pdf_page": 29,
      "type": "unknown",
      "source": "unknown"
    },
    {
      "pdf_page": 30,
      "type": "unknown",
      "source": "unknown"
    },
    {
      "pdf_page": 31,
      "type": "unknown",
      "source": "unknown"
    },
    {
      "pdf_page": 32,
      "type": "unknown",
      "source": "unknown"
    },
    {
      "pdf_page": 33,
      "type": "unknown",
      "source": "unknown"
    },
    {
      "pdf_page": 34,
      "type": "unknown",
      "source": "unknown"
    },
    {
      "pdf_page": 35,
      "type": "unknown",
      "source": "unknown"
    },
    {
      "pdf_page": 36,
      "type": "unknown",
      "source": "unknown"
    },
    {
      "pdf_page": 37,
      "type": "unknown",
      "source": "unknown"
    },
    {
      "pdf_page": 38,
      "type": "unknown",
      "source": "unknown"
    },
    {
      "pdf_page": 39,
      "type": "unknown",
      "source": "unknown"
    },
    {
      "pdf_page": 40,
      "type": "unknown",
      "source": "unknown"
    },
    {
      "pdf_page": 41,
      "type": "unknown",
      "source": "unknown"
    },
    {
      "pdf_page": 42,
      "type": "unknown",
      "source": "unknown"
    },
    {
      "pdf_page": 43,
      "type": "unknown",
      "source": "unknown"
    },
    {
      "pdf_page": 44,
      "type": "unknown",
      "source": "unknown"
    },
    {
      "pdf_page": 45,
      "type": "unknown",
      "source": "unknown"
    },
    {
      "pdf_page": 46,
      "type": "unknown",
      "source": "unknown"
    },
    {
      "pdf_page": 47,
      "type": "unknown",
      "source": "unknown"
    },
    {
      "pdf_page": 48,
      "type": "unknown",
      "source": "unknown"
    },
    {
      "pdf_page": 49,
      "type": "unknown",
      "source": "unknown"
    },
    {
      "pdf_page": 50,
      "type": "unknown",
      "source": "unknown"
    },
    {
      "pdf_page": 51,
      "type": "unknown",
      "source": "unknown"
    },
    {
      "pdf_page": 52,
      "type": "unknown",
      "source": "unknown"
    },
    {
      "pdf_page": 53,
      "type": "unknown",
      "source": "unknown"
    },
    {
      "pdf_page": 54,
      "type": "unknown",
      "source": "unknown"
    },
    {
      "pdf_page": 55,
      "type": "unknown",
      "source": "unknown"
    },
    {
      "pdf_page": 56,
      "type": "unknown",
      "source": "unknown"
    },
    {
      "pdf_page": 57,
      "type": "unknown",
      "source": "unknown"
    },
    {
      "pdf_page": 58,
      "type": "unknown",
      "source": "unknown"
    },
    {
      "pdf_page": 59,
      "type": "unknown",
      "source": "unknown"
    },
    {
      "pdf_page": 60,
      "type": "unknown",
      "source": "unknown"
    },
    {
      "pdf_page": 61,
      "type": "unknown",
      "source": "unknown"
    },
    {
      "pdf_page": 62,
      "type": "unknown",
      "source": "unknown"
    },
    {
      "pdf_page": 63,
      "type": "unknown",
      "source": "unknown"
    },
    {
      "pdf_page": 64,
      "type": "unknown",
      "source": "unknown"
    },
    {
      "pdf_page": 65,
      "type": "unknown",
      "source": "unknown"
    },
    {
      "pdf_page": 66,
      "type": "unknown",
      "source": "unknown"
    },
    {
      "pdf_page": 67,
      "type": "unknown",
      "source": "unknown"
    },
    {
      "pdf_page": 68,
      "type": "unknown",
      "source": "unknown"
    }
  ]
}
