{
  "magazine": "model_railroader",
  "issue": "1934-11",
  "schema_version": 1,
  "pages": [
    {
      "pdf_page": 1,
      "type": "unknown",
      "source": "unknown"
    },
    {
      "pdf_page": 2,
      "type": "editorial_page",
      "printed_page": "2",
      "source": "ocr"
    },
    {
      "pdf_page": 3,
      "type": "editorial_page",
      "printed_page": "3",
      "source": "ocr"
    },
    {
      "pdf_page": 4,
      "type": "editorial_page",
      "printed_page": "4",
      "source": "ocr"
    },
    {
      "pdf_page": 5,
      "type": "editorial_page",
      "printed_page": "5",
      "source": "ocr"
    },
    {
      "pdf_page": 6,
      "type": "editorial_page",
      "printed_page": "6",
      "source": "ocr"
    },
    {
      "pdf_page": 7,
      "type": "editorial_page",
      "printed_page": "7",
      "source": "ocr"
    },
    {
      "pdf_page": 8,
      "type": "editorial_page",
      "printed_page": "8",
      "source": "ocr"
    },
    {
      "pdf_page": 9,
      "type": "editorial_page",
      "printed_page": "9",
      "source": "ocr"
    },
    {
      "pdf_page": 10,
      "type": "editorial_page",
      "printed_page": "10",
      "source": "ocr"
    },
    {
      "pdf_page": 11,
      "type": "editorial_page",
      "printed_page": "11",
      "source": "ocr"
    },
    {
      "pdf_page": 12,
      "type": "editorial_page",
      "printed_page": "12",
      "source": "ocr"
    },
    {
      "pdf_page": 13,
      "type": "editorial_page",
      "printed_page": "13",
      "source": "ocr"
    },
    {
      "pdf_page": 14,
      "type": "editorial_page",
      "printed_page": "14",
      "source": "ocr"
    },
    {
      "pdf_page": 15,
      "type": "editorial_page",
      "printed_page": "15",
      "source": "ocr"
    },
    {
      "pdf_page": 16,
      "type": "editorial_page",
      "printed_page": "16",
      "source": "ocr"
    },
    {
      "pdf_page": 17,
      "type": "editorial_page",
      "printed_page": "17",
      "source": "ocr"
    },
    {
      "pdf_page": 18,
      "type": "editorial_page",
      "printed_page": "18",
      "source": "ocr"
    },
    {
      "pdf_page": 19,
      "type": "editorial_page",
      "printed_page": "19",
      "source": "human"
    },
    {
      "pdf_page": 20,
      "type": "editorial_page",
      "printed_page": "20",
      "source": "human"
    }
  ]
}
